type_test;competence;niveau;question;choix_A;choix_B;choix_C;choix_D;reponse;choix_multiple;points;audio_url;sujet_titre;sujet_contenu;sujet_audio_url
initial;CE;A1;Quel est le mot pour "bonjour" en français ?;Hello;Bonjour;Gracias;Danke;B;non;1;;;;
initial;CE;A1;Quelle phrase est correcte ?;Je suis content;Je suis contente;Les deux sont correctes;Aucune;C;non;1;;;;
initial;CO;A1;Écoutez. Quelle heure est-il ?;8h00;9h00;10h00;11h00;B;non;1;https://exemple.com/audio1.mp3;;;
final;CE;A1;Quel est le contraire de "grand" ?;Petit;Gros;Haut;Large;A;non;1;;;;
final;CO;A1;Écoutez. Où va la personne ?;Au marché;À la gare;À l'école;Au travail;A;non;1;https://exemple.com/audio4.mp3;;;
initial;CE;A2;Selon le texte, où habite Marie ?;À Paris;À Lyon;À Marseille;À Nice;A;non;1;;Texte - La famille de Marie;"Marie habite à Paris avec ses deux enfants. Elle travaille dans une école et adore cuisiner le week-end.";
initial;CE;A2;Combien d'enfants a Marie ?;Un;Deux;Trois;Aucun;B;non;1;;Texte - La famille de Marie;"Marie habite à Paris avec ses deux enfants. Elle travaille dans une école et adore cuisiner le week-end.";
initial;CO;A2;Écoutez le dialogue. Que commande le client ?;Un café;Un thé;Un jus;Une eau;A;non;1;;Audio - Au restaurant;;https://exemple.com/audio-restaurant.mp3
initial;CO;A2;Écoutez le dialogue. Quels plats sont proposés ?;La soupe;La salade;Les deux;Aucun;C;oui;2;;Audio - Au restaurant;;https://exemple.com/audio-restaurant.mp3
